{
  "$schema": "item@1",
  "id": "srd51.item.pike",
  "name": "Pike",
  "source": {"ref": "SRD 5.1", "license": "CC-BY-4.0"},
  "category": "weapon",
  "cost_cp": 500,
  "weight_oz": 288,
  "weapon_class": "martial",
  "reach": 10,
  "damage": [
    {"dice": "1d10", "type": "piercing"}
  ],
  "properties": ["heavy", "reach", "two_handed"]
}
