{
  "$schema": "item@1",
  "id": "srd51.item.battleaxe",
  "name": "Battleaxe",
  "source": {"ref": "SRD 5.1", "license": "CC-BY-4.0"},
  "category": "weapon",
  "cost_cp": 1000,
  "weight_oz": 64,
  "weapon_class": "martial",
  "reach": 5,
  "damage": [
    {"dice": "1d8", "type": "slashing"}
  ],
  "versatile_damage": [
    {"dice": "1d10", "type": "slashing"}
  ],
  "properties": ["versatile"]
}
